{
  "id": "DEV-008",
  "team": "dev",
  "parent": null,
  "title": "README + end-to-end test suite wiring",
  "type": "docs",
  "complexity": "M",
  "risk": "normal",
  "spec_ref": ".org/artifacts/specs/DEV-008.md",
  "inputs": [],
  "acceptance_criteria": [
    "README: setup (venv, pip install -r requirements.txt, playwright install chromium), how to run the agent, how to add a site to the allowlist, how to run/point the test site SMTP at Mailpit, how to bring up docker-compose",
    "pytest suite ties together: unit tests (allowlist refusal, classification, email/OTP, redaction), the 8889 e2e, and the email-auth-site e2e that skips cleanly when Docker is down",
    ".env.test.example documented; confirms node_modules / Playwright browsers / .env.test are gitignored",
    "Docker is UP now: the email-auth-site e2e MUST ACTUALLY RUN and PASS end-to-end (docker compose up -d Mailpit, start the test site, full discovery->join/verify->signin->success, extract link/OTP from Mailpit REST). The clean-skip path stays only as a fallback and must NOT trigger now."
  ],
  "assigned_model": "haiku",
  "design_skill": null,
  "budget": {
    "max_tokens": 20000,
    "max_rounds": 2
  },
  "status": "todo"
}